用户,是否看过,评分,评论时间,有用数,评论
曾良君,看过,推荐,2018-02-24 19:40:21,164,好看写实，但夏楠那条线太过古怪和整体氛围不搭，一秒出戏，并且因为中国电影迟迟不分级的缘故，电影院里非常多的小孩，这点太糟糕了。
木卫二,看过,还行,2018-02-18 00:01:07,241,活不错。一个人的林超贤，可以追赶荷里活level的战争片。你对血腥场面的恶心、反感和排斥，恰好符合了战争的本质。
雨前羽街,看过,还行,2018-02-19 21:50:48,334,珍惜一切在国内看到的R级片
谢谢你们的鱼,看过,较差,2018-02-10 21:31:18,3357,真人版吃鸡和低配版《使命召唤》，一场大型的闯关游戏，没有人物，没有剧情，没有主题，就是一通狂打，越到后面越视觉疲劳，不过最重要的问题还是空洞乏味，毫无起承转合，看完了连角色都没有认全，而作为主角的这些人在战场上装备都能随便捡，连坦克都能捡到，我也是服了编剧了。
泥铛,看过,较差,2018-02-09 17:28:24,2258,虽然不像吴京老师的片子那么油腻 但是全程疲劳轰炸 毫无章法 非常不喜欢。
亵渎电影,看过,还行,2018-02-23 16:38:23,204,节奏全靠配乐撑着，靠剪辑的快和机位的多撑起来的伪节奏感，如果没了配乐，也就无法看了。
璐璐,看过,还行,2018-02-16 15:08:59,239,有点看懵圈了，整体上比50亿那个片好但也只是一点。林超贤的那些直男热血元素很突出，可惜大密度的手持快剪强重音效配乐一顿狂轰滥炸完之后就没剩什么了。不喜欢这种策略，节奏太快全程狂赶枪战对决一场接一场，实则是对剧作方面不自信的露怯，海清那条线问题很大。尺度够大，这是优点。2.5
风间隼,看过,推荐,2018-02-05 20:14:53,416,“勇者无惧，强者无敌”的海军宣传片。动作戏份量足够，制作精良，爆破、追逐和军事打击场面都已经是好莱坞水准。没有《战狼2》那么多的草根国族YY，全是精准的节奏和奇观在主导影片。林超贤还是最擅长表现人在紧迫压力下的极端反应。张译和海清的表演很到位，狙击手的台词很别扭。
南“珂”一梦,看过,很差,2018-02-16 23:59:29,305,没剧情，从头到尾机关枪突突突，这也就忍了。但女主海清扣100颗星，完全不能忍，根本就是个疯婆子。
恶魔的步调,看过,还行,2018-02-16 21:13:45,161,没被撩到……可能是因为我不够直
我是一只鱼3008,看过,力荐,2018-02-16 15:02:59,446,太好看了，比战狼2好看多了
南先森,看过,力荐,2018-02-18 22:08:08,248,强烈呼吁电影分级制度！
Vamei,看过,还行,2018-02-20 22:26:32,113,咱真的不用讨论一下电影分级？我的前排坐着一个小孩。
邓安庆,看过,2018-03-12 16:42:52, ,70,电影里这么多血腥残暴的镜头，居然还有几位家长带孩子来看，真是不知道怎么想的。后来小孩子们觉得电影无聊，在放映厅里跑来跑去，我只能暗自庆幸孩子们没有认真看电影吧。哎，这些家长说他们什么好呢。
吴点半,看过,较差,2018-02-09 23:19:26,1958,突突突突突突突突突突突突突然后砰砰砰砰砰砰砰砰砰砰然后就结束了，基本没剧情，为了爆炸而爆炸，张涵予就是打酱油的。跟《湄公河行动》差了100个《战狼2》的距离。尴尬尴尬。
蜉蝣,看过,推荐,2018-02-05 18:22:08,305,故事性太弱，整个片狂轰滥炸看下来特别累。但战争戏扎实，场面逼真，也没有个人英雄主义。超出预期。
木西,看过,还行,2018-02-16 14:51:03,150,生干两小时，累心
九只苍蝇撞墙,看过,2018-02-18 23:26:55, ,50,剧情要是和战狼2接起来就好了：一群射击机器人和葫芦屯野生黑社会在非洲并肩战斗打坏人，合家欢适合春节看
君不知,看过,力荐,2018-02-09 17:09:42,477,看的首映 先说一下全片无尿点 节奏紧张 代入感很强 其次很血腥。。震撼了 这还是中国电影吗 竟然都没剪掉 最后就是春节档期可能会炸 极为震撼
朝阳区陆依萍,看过,还行,2018-02-16 16:41:21,99,是动作片！有缺陷，也有视觉疲惫的部分，但后半段营救人质非常厉害！比《战狼》好的是没有刻意塑造金刚不坏的英雄形象，反倒着力人物群像，林超贤更证明了不是所谓的武器升级，大炮导弹狂轰滥炸就更厉害，而是如何编排，运镜，控制节奏，扬长避短！#家长们长点心，不要带孩子来看，这场就好多吓哭的#
mlln,看过,还行,2018-02-21 16:56:42,77,commercial nationalism.
大海里的针,看过,力荐,2018-02-17 14:48:40,174,林超贤已经超神了，如果好莱坞大片是史泰龙模式，那《红海行动》就是COD死亡模式！一个炸弹打过来血肉横飞的血腥场面，在国产片里真是很少见了。
猛汉世雄,看过,推荐,2018-02-19 22:08:28,146,黄景瑜也是绝了，蓝天的蓝不会写，狙击的狙也不会读，台词照例说的像在嘴里含了两颗枣，以前含大枣，这次略有进步，含的枣小了一些，不过黄景瑜运气也真是好，拿到这角色太帅太苏了，看得我淫笑连连。电影没啥好说的，劈劈啪啪打满两个钟头，打得血肉横飞，不适宜老人及儿童观看。希望世界和平。
秋田木,看过,力荐,2018-02-18 22:02:37,241,豆瓣有些自命清高的观影者。。不知道如何满足他们。无所谓，很燃了，能抓住眼球的就是好电影，全片高能
突然粉碎,看过,较差,2018-02-16 05:13:53,1505,已经有《战狼2》，为什么还要拍《红海行动》，是为了彰显中国海军上天入地无所不能么？全员不听指挥没一点军人的样子，计划总是失败PlanB也陷入尴尬险情，想吹中国军人灵活机智都没得吹，没勇气拍成《侠盗一号》全员阵亡，反而拍成作死小队贻笑大方
西楼尘,看过,较差,2018-02-11 13:58:09,1362,听到助理记者被处决，夏楠不知该进还是出，捏着那个蓝色手链万念俱灰。原来她努力了这么久，还是谁也不能保护；看到两名队员的裹尸袋，杨锐再也没法撒谎，他佯装镇定，明白当军人就要有马革裹尸的觉悟。红海边的沙尘里，人们称颂着勇者无惧强者无敌，其实我是怕昨天偷了你一块糖，今天却要这样喂给你。
UFO攻击磁器口,看过,很差,2018-02-24 12:42:12,152,希望中国能够多一点正常的电影
唐小万,看过,较差,2018-02-16 13:48:45,942,完全不是我的菜，看得好累。
托尼·王大拿,看过,还行,2018-02-21 20:14:08,42,堆积动作和战斗场面的同时再配上大量流水线质感聒噪配乐其实还是挺能唬弄人的，视听双管齐下保证你没时间多寻思，血腥度相当够劲——影厅里有个孩子哇哇大哭活跃全场；看完回家第一件事是找出来《拯救大兵瑞恩》扫一眼，透彻理解障眼囤积与真正调度之间的区别。
脱钩者,看过,较差,2018-02-16 05:49:15,767,我就问问你们为何打起来？这不就比战狼2好50步嘛
twotwo,看过,力荐,2018-02-19 19:00:27,172,这才二月底，年度最佳国产片已经诞生了。另外选角真的很重要啊，你说要是选了杨洋啊，李易峰啥的来演这个……还是出场就死了算了。
小川叔,看过,还行,2018-02-26 10:52:44,46,不好看就是不好看，这是个人感受，和爱不爱国什么没关系，我始终觉得如果电影只是为了炫技巧和看爆破，真的没必要花这么多钱，还是要把故事讲好，不论是不是真实故事改编，都需要讲节奏和方式，而不是宣贯，看完记不住人物和台词，只记住爆破，我不觉得这是一个好的作品，至少我自己欣赏不来。恩。
万峰,看过,力荐,2018-02-17 23:10:38,110,年纪大了，看不了这么猛的动作片了
qw0aszx,看过,较差,2018-02-16 12:44:36,757,哪有这样从头到尾动作戏都是这种最没看头的拍法还一路拍下去一点都没改的，加上剪辑也是一个路子到底，片子到一半就彻底疲劳了，再后面看下去反倒催眠起来了... 4.9分★★☆
人生啊地不熟,看过,还行,2018-02-08 13:36:39,97,战狼+湄公河 不足20%的文戏 全程炸炸炸 人物没一个能立起来的 林超贤这次想表达的太多 却用了重复感严重的叙事手法 如果这是为了迎合内地观众青睐节奏紧张的大场面、以为直男电影会再次掀起票房高潮的话 那真的是有所误解了 而且片子的血腥程度 放到春节档实在不合适 中国主旋律为何只有荷尔蒙和重武器
小川   靜,看过,力荐,2018-02-16 00:21:20,392,實話説：很少看這麽硬的電影，被預告的大場面吸引進了戲院。果然沒失望，該有的場面很震撼，這是一個團體作戰，非個人英雄主義，比較能感動人心。沒有流量演員卻讓觀影者心中深深留下每個英雄的身影。春節看這麽燃的電影，感覺自己新的一年更有幹勁。
seamouse,看过,还行,2018-02-16 12:23:23,43,没有呼喊中国非洲妈妈了，场面虽夸张有漏洞，但还算厉害，没法加入各方政治交易就干脆从头炸到尾。在蛟龙突击队独闯龙潭这段重头戏，编剧显然没能为一次性解决黄饼危机算清楚可翻转的剧情，于是不得不画蛇添足，在营救人质主要任务完成后，来上那么一条狗尾。没载人质也不追击的坦克战也毫无存在必要。
辽远,看过,很差,2018-02-18 14:40:36,118,敢比黑鹰坠落?  意义就差远了好吧
五色全味,看过,还行,2018-02-21 03:30:21,37,林超賢借主旋律資源大玩類型，上天入海，規模數倍升級了自己曾經的《神枪手》《重裝警察》，製作能力上遠拋《戰狼》，並不刻意販賣民族主義。證明香港電影導演今時今日仍舊充滿執行力和活力，深入異地仍能打出一片天的蛟龍部隊不就是香港電影人嗎？人物和感情的積弱是老毛病，血腥場面太多不宜
娅娅娅,看过,力荐,2018-02-16 00:43:47,370,一气呵成，没有大段文戏，主要在作战间隙穿插，但却更好展现了蛟龙突击队状态，两个狙击手之间的紧绷又协作的关系，女兵机枪手和石头之间感情，表现的不多确很到位每个人物都很立体不会拥挤也不会冲突，其他就是宏大的场面，燃燃燃，爽爽爽，看的酣畅淋漓，影片质量之高可以说是中国战争片的里程碑了！
君寻,看过,推荐,2018-02-16 15:01:25,296,→_→母亲大人说比战狼有意思，我表示赞同~
人参,看过,很差,2018-02-17 18:06:26,140,我爱国，但是这种类型的片子真的，爱不起来。
Ms_underwater,看过,还行,2018-02-19 00:33:24,57,就想问问那个带炮儿的无人机早干吗去了
一口可乐,看过,还行,2018-02-18 22:06:05,71,炸到睡着
巴伐利亞酒神,看过,推荐,2018-02-16 16:44:06,149,大年初一带半个军迷的老头子和打酱油的老娘观此片，预料中的人丁兴旺，未预料的意兴盎然。咋说呢，从动作层面到思想境界，都领先了战狼2无穷尽个身位。战斗场面，强调团队作战，没有个人英雄主义；而不仅仅营救中国人质，将外籍人质也一起营救的决定，也瞬时拔高了整个立意，去除了狭隘的民族主义。
darkcat,看过,推荐,2018-02-22 18:33:31,47,看完想赶紧吃两把鸡
三七莲华,看过,推荐,2018-02-16 22:05:56,65,不怎么煽情的国产片值得珍惜！缺点也是文戏太弱了一定要把中国拖下水的叛军脑子瓦特了吧。比战狼好了一个湄公河，而且难得分工明确的团队合作，看起来真实很多，基本从头打到尾劈里啪啦忍不住想这是在补春节放不了烟花爆竹的遗憾吗……哦对需要警告不少血腥场面不太适合儿童观看。
阿德,看过,推荐,2018-02-16 07:06:50,145,解救人质那段堪称华语电影最佳战争动作戏，冲锋战、狙击战、小巷追逐战、沙漠坦克战，场面不断升级，根本不给你喘息机会，林超贤奉献了一部好莱坞水准的军事战争大片。
熊阿姨,看过,推荐,2018-02-21 22:17:11,66,不用恶心人也能干干净净拍撤侨。
腻腻,看过,还行,2018-02-18 21:59:42,82,真的就不咋的阿...挺假的- -
馬尾士,看过,很差,2018-02-24 13:07:32,131,头都炸疼了。画面生猛，意义单薄。
古戈,看过,还行,2018-02-21 20:10:51,38,难以想象这部电影会有这样的高分。除了画面镜头和各种装备，其他乏善可陈。情节转化突兀，拼接痕迹严重。人物先后转变也有点莫名其妙。想描写很多人，结果主次不分，没写好任何一个人。这不是一个完整的故事，这是一个拼盘。整体成熟度上远逊色于战狼2。
A L E X,看过,2018-02-28 20:53:33, ,27,我再也不想看这样的电影了
LORENZO 洛伦佐,看过,还行,2018-05-22 00:39:35,18,都说好但没看出来和战狼或者湄公河的区别啊，就是煽情少一点点了越来越好莱坞了？会拍这种电影怎么就叫好了？好莱坞多少电影后期和技术不是外包给中国做了？
shininglove,看过,还行,2018-02-22 19:08:04,22,海陆空伟哥大电影！
姚璐,看过,还行,2018-02-19 20:08:39,42,这个电影不分级真的好吗。。电影院的小朋友都吓傻了。。
wly,看过,推荐,2018-02-16 15:10:03,229,狙击手好厉害好炫酷，唯一一个女兵巾帼不让须眉，枪林弹雨我真的好担心她。还有吃糖剧情时候就隐隐感觉到FLAG。虽然我不太懂各式武器，还是看到燃。大尺度的血腥场面演绎残酷战场，也许为了能播血腥景，还是有几处略生硬的强行体现主题。
蓝下老婆,看过,力荐,2018-02-16 00:33:06,373,真是太震撼了，全程看得热血沸腾，不愧是大制作手笔，还有我喜欢的景瑜，更是锦上添花，支持
哎哎哎,看过,力荐,2018-02-16 12:10:01,270,很燃很燃，太厉害了…
Franz,看过,较差,2018-02-17 13:58:28,731,无聊，冒死营救非洲战乱区华侨的故事，第一次看到一半退场。一路不停的打打杀杀，评论里面夸的文戏不超过二十分钟，也可以从另一个角度说明，电影几乎没有情节，全是战争场面；本是因为8.5的高分被吸引，现在看来水分很大，爱国主旋律想要复制战狼2的成功，可惜未得精髓；借政治正确，消费爱国情怀
国王KING,看过,推荐,2018-02-21 20:53:00,35,光是「我们带你回家」就看得热泪盈眶……感觉观看过程全程神经紧绷，炮火与子弹看得触目惊心。
青 天大老爷,看过,力荐,2018-02-19 19:44:42,81,有可能因为时长问题删减了部分片段，使得剧情几个点有bug。整部剧节奏紧凑，没有一点浪费的片段，全程高能。我以为会有第二部，可是在电影最后十分钟还是快速结束了黄饼问题。有几处血腥的画面，少儿不宜。不同于一般的个人英雄主义，红海更强调团队合作精神。
麦垄风来翠浪斜,看过,推荐,2018-02-23 11:52:52,70,还挺激动人心的，场面宏大，作战意识武器先进，我个人来说挺好的，很爽啊，子弹横飞的。但我小表妹给吓着了，场面对她来说有点血腥了，不建议小孩和胆子比较小的女生去看，大半夜的看完电影安慰人真的很累。
獨孤島主,看过,推荐,2018-02-16 22:39:07,33,扬长避短，把讲耶稣放在第二位，全力开动类型片的纯粹快感，思路非常清楚，但最后夺饼单独开一场而不直接连贯情绪，有点奇怪
齐木楠雄,看过,推荐,2018-02-24 15:12:43,15,电影很激烈，看着很累，炮弹与断肢横飞，各种断手断腿特写，还有打穿动脉的飙血特写，各种新式装备层出不穷，更适合装备控观看，为嗯哼爸爸打CALL，大荧幕上超级帅
神探夏老师,看过,2018-02-28 14:06:02, ,20,如果是三天前我看这部电影，会觉得很好看，甚至会觉得为这个国家感到骄傲，但是经历了那件事情，我现在只觉得恶心。对不起这部电影，可看性真的很高，良心之作。不打分了。
透明,看过,力荐,2018-02-16 21:40:16,50,我们再也不用拿《英雄》《长城》 这种片来定义国产大片了！！！
内陆飞鱼,看过,推荐,2018-03-03 22:13:13,20,不错，接近好莱坞水准了，从湄公河到红海，林超贤一直在立行业标杆，而且无人可破，只能自己挑战自己了。
小痕呀,看过,推荐,2018-04-04 22:05:35,13,我因我的祖国而骄傲，拍的很燃很热血。
朱3D,看过,力荐,2018-02-18 22:05:27,69,“和平年代”限制了我们的想象力，真实的战争可能远比电影更加残酷。
reply1988,看过,力荐,2018-02-16 12:08:06,190,大年初一，期待已久！绝对是国产同类型的里程碑，超越了湄公河行动。全程2个小时我精神紧绷，买的水都忘记喝了。沙漠坦克追逐、翼装飞行、狙击射击，很多元素都具备了，真的很棒！血腥镜头也非常惨烈，真的希望那些巨婴们看看我们的军人是怎么保护我国公民的！有些衔接很突兀，但是瑕不掩瑜！
冉笛,看过,很差,2018-02-17 20:09:05,0,与各种不同肤色的人一起看完这一部中国海军英雄赞歌。武戏无问题，全程无文戏的结果是故事紧张有余感染力不足，人物形象扁平（其实顾顺和李懂这条线本可以制造戏剧性的，顾顺接替罗星上阵，顾顺很拽，李懂习惯了罗星，这就是一个很好的切入点，即：两人如何化解矛盾，如何成为心心相惜的战友）可惜。浪费了一众好演员。
金伯颜,看过,力荐,2018-02-17 14:06:16,115,国产战争救援片逼近世界顶尖水准的证明之作。
公园笨龙,看过,力荐,2018-02-17 02:15:08,54,尺度真大…超过好莱坞了…我喜欢
明太鱼团子,看过,推荐,2018-02-20 13:05:33,58,行动线的清晰度完全不够，到后面根本分不清到底是哪几方势力在对打。还有黄景瑜演的那个狙击手虽然是又拽又痞，但莫名觉得gay里gay气……一直在撩人家观察员（
天亮天黑,看过,还行,2018-02-20 16:10:58,30,这部电影，描绘了一种非常写实的场景：支援力量为零，战术屡次不灵，上级只能请示，任务必须完成。
七七,看过,还行,2018-02-22 20:41:28,42,还算不错，只是大过年的实在不适合带娃看红海，太血腥！
Derridager,看过,还行,2018-02-26 21:21:30,15,看来随着新时代加冕时刻的到来，这样媒介化构建国家形象和输出强国意识形态的中特民族主义电影肯定还少不了。制作自然没问题，可是依然屡有不适。原因如下：发展中国家就想迈大步子输出新霸权主义，其实是蛇吞象；打来打去展现的只是外在力量，内在的精神部分欠缺；另，不反战的战争片没有太大价值。
[已注销],看过,很差,2018-02-26 22:17:47,17,林超贤本来是香港三流导演里我蛮欣赏的一个。
郭连凯,看过,推荐,2018-02-18 18:58:04,27,4.5 this is some real shit!!!!
西屿,看过,力荐,2018-02-18 22:09:53,69,PLA牛逼！！！！！没有一个镜头是浪费的！！！！！
Tyger Tyger,看过,还行,2018-02-18 10:18:40,11,作为动作片，合格。最后抢核原料一段，单独看无问题，可对照前头大段渲染的战斗残酷与艰难的基调，就显得轻飘和不接。对手的那个小狙击手，敢情林超贤一定看过《黑猫警长》～～
请叫我鬼叔好么,看过,还行,2018-02-23 13:06:11,24,7分吧，情节细节太薄弱，就剩突突突了
小鱼变成老鱼了,看过,推荐,2018-02-21 04:47:48,23,脸盲患者到最后都没把几个人谁是谁对上号……
Hey Johnny,看过,推荐,2018-02-20 17:55:14,23,勇者无惧，强者无敌，爱我中华，扬我国威！——主旋律电影新打法。
无忌,看过,力荐,2018-02-18 22:08:56,72,接下来不知道哪个部门找林超贤拍大片？！期待。
品客,看过,推荐,2018-02-17 23:52:46,28,林超贤这一次超水平发挥了，除了空间感较差，湄公河行动里的问题都得到了解决。各种成熟好莱坞战争片的元素融合让电影拥有了一种大杂烩的特殊风味（是褒义）。
躲猫猫社社长,看过,较差,2018-02-18 01:01:34,27,没完没了，只知道使劲塞塞塞，预算足，完全不知收敛。前一个小时有出彩之处，之后逐渐进入Team America模式。另外，解放军廉价的站桩式指挥室、操作系统、制服和央视纪录片介绍字幕向大家展示了几乎为负的审美。号称真实事件改编已经无耻之极，和《黑鹰坠落》比拜托要点脸。
狐,看过,推荐,2018-02-10 22:53:47,200,看了超前点映，意外的精彩，二刷了IAMX。没有那么多个人英雄和国族情绪，战斗情节的专业度和观赏性都已经是国片最佳水平，堪称世界级。剧本是减分项，人物代入感弱，也许是有意要维护军人形象，不去探讨人性话题，比如傲慢狙击手，冲动记者和保守指挥官都是经典的可以发挥的人物。总体瑕不掩瑜。
霧鳥,看过,很差,2018-02-16 09:42:01,82,并不算太好
Violet何舒,看过,力荐,2018-02-17 20:41:03,35,林超贤导演真的太棒了！国际水准，走心之作！很久没有看到这样的院线片了，赞赞赞！
#阿子#,看过,还行,2018-02-22 13:16:54,11,强烈呼吁电影分级，血糊糊烂肉镜头太多了。必须强调不适合小朋友看！！！海清还是有点尬，张译演得很不错。巨型官方军力宣传片最后还是海军赢了。剧情不能多想，感觉玩游戏的人看了会很熟悉……看完之后午饭果断吃素了
SydneyCarton,看过,推荐,2018-02-21 18:08:46,21,湄公河是警匪片，战狼2是动作科幻片，红海是战争片。
勾勾子,看过,推荐,2018-02-24 13:05:04,27,相比战狼的个人英雄主义bug，这部的团魂是碾压式的。勇者无惧不是因为无所畏惧，而是因为敬畏死亡又心怀大爱。
庄小龙也有尾巴,看过,力荐,2018-02-23 14:34:59,12,"无论你在世界的哪个地方，只要联系中国领事馆，我们就会保障你的安全。
这世上哪有什么岁月静好，只不过有人替我们负重前行。
向所有军人致敬！"
拐了,看过,还行,2018-02-09 23:48:15,60,中国版《黑鹰坠落》，就军事和战场层面制作非常出色。
水浒三国金刚,看过,推荐,2018-02-23 12:33:47,15,拯救同胞邓梅
spencer,看过,力荐,2018-02-17 17:03:49,31,怎么也想不到2018年就能看到这样的军事电影，这个国家进步的速度总是出人意料。
iriselite,看过,还行,2018-02-19 16:15:06,18,作为电影而言，毫无叙事章法，人物塑造。。。只有感官刺激了。
苏妄言,看过,力荐,2018-02-17 12:07:15,39,没有对比就没有伤害，没有战狼2的存在，这片子也就是是三星到四星的水平。林超贤导演在某种程度上就是影片质量的保证！
