用户,是否看过,评分,评论时间,有用数,评论
徐达多,看过,较差,2019-02-06 17:53:06,10,这么多年一点长进都没有，还在耍小聪明，还在拍MV，还是毫无叙事技巧，还在用一样的转场手段，一次次毫无节制的用，毫不重要的情节大费笔墨，想看的赛车狂飙点到为止，真是片中韩寒自己写的台词那样：你不是比别人有更多付出，也不比别人在拍电影上更有天赋，你只是坐拥更多的资源获得了更多的关注，靠着浪费资源取得了常人难以拥有的机会去为自己的前半生拍一部电影。这是韩寒式的成功，在电影上面，和郭敬明式成功并无区别。为片尾终于难得的真情怀加一星。
随意,看过,力荐,2019-02-06 10:38:32,11,真的好好看 看了两遍的我 说实话第一遍我只觉得好笑 第二遍才觉得只是在这么难的人生找到了一些欢乐 黄景瑜也太帅了吧 演的也是好好啊沈叔叔给你点赞
空山,看过,较差,2019-02-05 18:42:52,12,克制金句的段子电影，模式化的故事，干瘪的人物，最后强行升华。韩寒电影的笑点设置，总比观众慢一拍，从《后会无期》到《飞驰人生》，没有任何改进。还去翻了一下《像少年啦飞驰》，文字也有这个缺点，永远让你笑不痛快。全片最震撼的是绿色赛车冲出赛道，跌落悬崖。赛车，真危险。
焚紙樓,看过,较差,2019-02-23 13:03:08,7,搞懂了，今年的四部賀歲片是兩個陣營在比拚，前三片的陣營特徵在於觀後感起手於「以這作者（寧浩／韓寒／周星馳）而言……」，剩下那片則起手於「以中國而言……」。而最終票房證明了，即便在9012年，華人的品味依舊是是如此可愛的：數大為美。
萨库拉,看过,还行,2019-02-05 15:33:33,7,韩寒一卖弄小聪明我就昏昏欲睡，整体比较套路无惊喜，但结尾有加分。一定要挑优点的话大概是他对老歌有自己的品味，延续了《乘风破浪》里配乐的化学反应。
